{
  "manifestVersion": 1,
  "id": "parallx-community.flashcards",
  "name": "Flashcards",
  "version": "0.2.0",
  "publisher": "parallx-community",
  "description": "Spaced-repetition flashcards: create from canvas pages, PDFs, and photos; study with SM-2 scheduling; discuss cards with the AI; track progress.",
  "main": "main.js",
  "activationEvents": ["*"],
  "engines": {
    "parallx": "^0.1.0"
  },
  "contributes": {
    "icons": [
      { "id": "px-flashcards", "svg": "<svg viewBox=\"0 0 24 24\" fill=\"none\" stroke=\"currentColor\" stroke-width=\"2\" stroke-linecap=\"round\" stroke-linejoin=\"round\"><rect x=\"7.5\" y=\"5\" width=\"13\" height=\"10\" rx=\"1.5\"/><path d=\"M10.5 9 L17.5 9\"/><path d=\"M4.5 9 L4.5 17 A2 2 0 0 0 6.5 19 L15 19\"/></svg>" }
    ],
    "commands": [
      { "id": "flashcards.open", "title": "Open Flashcards", "category": "Flashcards" },
      { "id": "flashcards.study", "title": "Study Due Cards", "category": "Flashcards" },
      { "id": "flashcards.customStudy", "title": "Custom Study (Work Ahead)", "category": "Flashcards" },
      { "id": "flashcards.newDeck", "title": "New Deck", "category": "Flashcards" },
      { "id": "flashcards.newCard", "title": "New Card", "category": "Flashcards" },
      { "id": "flashcards.generate", "title": "Generate Cards from Source (AI)", "category": "Flashcards" },
      { "id": "flashcards.stats", "title": "Show Progress & Stats", "category": "Flashcards" },
      { "id": "flashcards.studyTag", "title": "Study One Tag", "category": "Flashcards" },
      { "id": "flashcards.reclassifyByType", "title": "Typed Answers for Concept and List Cards", "category": "Flashcards" },
      { "id": "flashcards.addCards", "title": "Add Cards", "category": "Flashcards" }
    ],
    "viewContainers": [
      {
        "id": "flashcards-container",
        "title": "Flashcards",
        "icon": "px-flashcards",
        "location": "sidebar"
      }
    ],
    "views": [
      {
        "id": "flashcards.decks",
        "name": "Decks",
        "defaultContainerId": "flashcards-container"
      }
    ],
    "editors": [
      {
        "typeId": "flashcards",
        "displayName": "Flashcards"
      }
    ],
    "configuration": [
      {
        "title": "Flashcards",
        "properties": {
          "flashcards.dailyNewLimit": {
            "type": "number",
            "default": 20,
            "description": "How many NEW cards one study session introduces. This is a batch size, not a daily ceiling: finishing a session and starting another hands you the next batch, and Custom Study reaches the rest directly."
          },
          "flashcards.dailyReviewLimit": {
            "type": "number",
            "default": 200,
            "description": "How many due review cards one study session serves. A batch size, not a daily ceiling."
          },
          "flashcards.shuffle": {
            "type": "boolean",
            "default": false,
            "description": "Shuffle each study session so cards from different decks and chapters mix instead of coming in schedule order. Learning cards still come first. The Shuffle button in the study toolbar toggles this and reorders the rest of the current session."
          },
          "flashcards.paceNewCards": {
            "type": "boolean",
            "default": true,
            "description": "Pace new-card introduction to each deck's exam date: a session's new batch becomes the rate that finishes introducing every card before the freeze window. It shrinks below the batch size when there is time to spare, and RAISES above it when the deadline needs more - a large deck would otherwise never finish, and the deck card would only show a completion date past the exam. The deck card says when a rate was raised. Decks without an exam date keep the fixed batch."
          },
          "flashcards.freezeDays": {
            "type": "number",
            "default": 14,
            "description": "Days before the exam when new-card introduction stops and sessions become pure review. The pacing rate is computed to land every card before this window opens."
          },
          "flashcards.generationDensity": {
            "type": "string",
            "default": "balanced",
            "description": "How selective AI card generation is when the count is Auto. 'thorough' = one card per atomic fact; 'balanced' = every core concept gets a card, minor detail consolidates; 'lean' = exam-critical methods, formulas, and assumptions only. Density shapes selectivity across the whole material - it never truncates coverage mid-chapter."
          },
          "flashcards.productionRecall": {
            "type": "boolean",
            "default": true,
            "description": "Let AI generation mark cards that should be ANSWERED rather than recognised, and give each one a rubric of the points a correct answer must make. A card is marked for a written answer whenever a correct response is a sentence rather than a bare name or number - definitions included; lists and formulas get their own answer types. Those cards ask you to type an answer, graded against the rubric and the source passage the card came from. Recognising a card you cannot actually state is the main way self-grading overstates what you know."
          },
          "flashcards.productionDailyLimit": {
            "type": "number",
            "default": 12,
            "description": "How many cards requiring a typed answer one study session serves. Counted separately from the review batch because a typed answer takes 30-60 seconds against roughly 5 for a recognition card, so mixing them into one allowance would quietly shrink how much you actually cover. 0 = no separate cap."
          },
          "flashcards.leechThreshold": {
            "type": "number",
            "default": 5,
            "description": "Lapses before a card is flagged as a leech (repeatedly failed; likely needs rewording)."
          },
          "flashcards.aiModel": {
            "type": "string",
            "default": "",
            "description": "Model id used for card generation and card discussion. Leave empty to use the chat's active model."
          },
          "flashcards.generationContext": {
            "type": "number",
            "default": 0,
            "description": "Context window (tokens) requested for card generation and discussion. 0 = auto: sized per run from the document length, card count, and the model's real context limit. Set a fixed value only to cap VRAM on smaller machines; material is clipped to fit whatever window is used."
          },
          "flashcards.aiThinking": {
            "type": "boolean",
            "default": true,
            "description": "Let reasoning models (qwen3.x, DeepSeek-R1) think before writing cards, judging answers or answering discussion questions. Better cards with fewer mistakes, at the cost of slower runs. Turn it off only on a machine where generation is too slow."
          },
          "flashcards.dailyReminder": {
            "type": "boolean",
            "default": false,
            "description": "Schedule a daily background AI check that nudges you (via chat) when cards are due. Runs through the cron scheduler and respects the autonomy dial."
          },
          "flashcards.reminderTime": {
            "type": "string",
            "default": "09:00",
            "description": "Local wall-clock time (HH:MM) for the daily reminder check."
          }
        }
      }
    ]
  }
}
