{
  "manifestVersion": 1,
  "id": "parallx.browser",
  "name": "Browser",
  "version": "0.3.0",
  "publisher": "parallx",
  "description": "A private browser inside Parallx: ads and trackers blocked, third-party cookies stripped, HTTPS only, permissions asked, storage sealed off from the app and the AI. See docs/BROWSER.md.",
  "main": "main.js",
  "activationEvents": ["*"],
  "engines": {
    "parallx": "^0.1.0"
  },
  "contributes": {
    "menus": {
      "viewContainer/title": [
        { "command": "browser.newTab", "group": "1_new", "when": "activeViewContainer == 'browser-container'" },
        { "command": "browser.newPrivateTab", "group": "1_new", "when": "activeViewContainer == 'browser-container'" },
        { "command": "browser.openBookmarks", "group": "2_open", "when": "activeViewContainer == 'browser-container'" },
        { "command": "browser.openHistory", "group": "2_open", "when": "activeViewContainer == 'browser-container'" },
        { "command": "browser.clearData", "group": "3_data", "when": "activeViewContainer == 'browser-container'" }
      ]
    },
    "commands": [
      { "id": "browser.newTab", "title": "New Tab", "category": "Browser" },
      { "id": "browser.newPrivateTab", "title": "New Private Tab", "category": "Browser" },
      { "id": "browser.openBookmarks", "title": "Bookmarks", "category": "Browser" },
      { "id": "browser.openHistory", "title": "History", "category": "Browser" },
      { "id": "browser.openShields", "title": "Blocked Trackers", "category": "Browser" },
      { "id": "browser.openUrl", "title": "Open Address", "category": "Browser" },
      { "id": "browser.focusAddress", "title": "Focus Address Bar", "category": "Browser" },
      { "id": "browser.find", "title": "Find In Page", "category": "Browser" },
      { "id": "browser.reload", "title": "Reload", "category": "Browser" },
      { "id": "browser.back", "title": "Back", "category": "Browser" },
      { "id": "browser.forward", "title": "Forward", "category": "Browser" },
      { "id": "browser.bookmark", "title": "Bookmark This Page", "category": "Browser" },
      { "id": "browser.zoomIn", "title": "Zoom In", "category": "Browser" },
      { "id": "browser.zoomOut", "title": "Zoom Out", "category": "Browser" },
      { "id": "browser.zoomReset", "title": "Reset Zoom", "category": "Browser" },
      { "id": "browser.toggleReader", "title": "Reader Mode", "category": "Browser" },
      { "id": "browser.sendToChat", "title": "Send Page To Chat", "category": "Browser" },
      { "id": "browser.clearData", "title": "Clear Browsing Data", "category": "Browser" },
      { "id": "browser.clearAgentData", "title": "Clear Assistant Browser Data", "category": "Browser" },
      { "id": "browser.refreshLists", "title": "Refresh Filter Lists", "category": "Browser" }
    ],
    "keybindings": [
      { "command": "browser.focusAddress", "key": "Ctrl+L", "when": "activeEditor == 'browser.page'" },
      { "command": "browser.find", "key": "Ctrl+F", "when": "activeEditor == 'browser.page'" },
      { "command": "browser.reload", "key": "Ctrl+R", "when": "activeEditor == 'browser.page'" },
      { "command": "browser.reload", "key": "F5", "when": "activeEditor == 'browser.page'" },
      { "command": "browser.back", "key": "Alt+ArrowLeft", "when": "activeEditor == 'browser.page'" },
      { "command": "browser.forward", "key": "Alt+ArrowRight", "when": "activeEditor == 'browser.page'" },
      { "command": "browser.bookmark", "key": "Ctrl+D", "when": "activeEditor == 'browser.page'" },
      { "command": "browser.zoomIn", "key": "Ctrl+=", "when": "activeEditor == 'browser.page'" },
      { "command": "browser.zoomOut", "key": "Ctrl+-", "when": "activeEditor == 'browser.page'" },
      { "command": "browser.zoomReset", "key": "Ctrl+0", "when": "activeEditor == 'browser.page'" },
      { "command": "browser.newTab", "key": "Ctrl+T", "when": "activeEditor == 'browser.page'" },
      { "command": "browser.newPrivateTab", "key": "Ctrl+Shift+N", "when": "activeEditor == 'browser.page'" },
      { "command": "browser.openHistory", "key": "Ctrl+H", "when": "activeEditor == 'browser.page'" },
      { "command": "browser.openBookmarks", "key": "Ctrl+Shift+O", "when": "activeEditor == 'browser.page'" }
    ],
    "viewContainers": [
      { "id": "browser-container", "title": "Browser", "icon": "globe", "location": "sidebar" }
    ],
    "views": [
      { "id": "browser.sidebar", "name": "Browser", "defaultContainerId": "browser-container" }
    ],
    "editors": [
      { "typeId": "browser.page", "displayName": "Web Page" }
    ],
    "configuration": [
      {
        "title": "Browser",
        "properties": {
          "browser.searchEngine": {
            "type": "string",
            "default": "duckduckgo",
            "enum": ["duckduckgo", "brave", "startpage", "google"],
            "description": "Where typed searches go. DuckDuckGo by default."
          },
          "browser.homepage": {
            "type": "string",
            "default": "about:newtab",
            "description": "What a new tab shows. about:newtab is the built-in page with your bookmarks and recent history; any https address works too."
          },
          "browser.clearOnExit": {
            "type": "boolean",
            "default": false,
            "description": "Clear the browser's cookies, cache and site storage when Parallx closes. History and bookmarks stay."
          },
          "browser.pageTheme": {
            "type": "string",
            "default": "system",
            "enum": ["system", "dark", "light"],
            "description": "What web pages are told you prefer. Sites that offer a dark theme follow it; sites without one are not changed. System uses your Windows setting."
          },
          "browser.showBookmarksBar": {
            "type": "boolean",
            "default": true,
            "description": "Show your starred pages as a row of chips under the address bar."
          },
          "browser.openLinksInApp": {
            "type": "boolean",
            "default": true,
            "description": "Open web links clicked anywhere in Parallx (pages, notes, chat, PDFs) in a browser tab here. Off: links open in your system browser. Open In System Browser in the page menu always does."
          },
          "browser.blockAnnoyances": {
            "type": "boolean",
            "default": true,
            "description": "Also hide cookie consent banners, newsletter and social overlays and other annoyances (EasyList Cookie and the uBlock annoyance lists). Off: ads and trackers only, which is what Brave ships by default."
          },
          "browser.holdRedirects": {
            "type": "boolean",
            "default": true,
            "description": "When a page you have been on sends you to another site on its own, wait for you to say Continue. Links you click and pages that redirect as soon as they load are not affected. A window a page opens on your click can never also send this tab elsewhere; that is blocked either way."
          }
        }
      }
    ]
  }
}
