{
  "manifestVersion": 1,
  "id": "parallx.terminal",
  "name": "Terminal",
  "version": "1.0.0",
  "publisher": "parallx",
  "description": "Integrated terminal panel. Runs shell commands in the workspace.",
  "main": "./main.js",
  "engines": { "parallx": "^0.1.0" },
  "activationEvents": ["onStartupFinished"],
  "contributes": {
    "commands": [
      {
        "id": "terminal.clear",
        "title": "Terminal: Clear",
        "aiInvocable": true,
        "aiDescription": "Clear the active terminal."
      },
      {
        "id": "terminal.restart",
        "title": "Terminal: Restart Shell",
        "aiInvocable": true,
        "aiDescription": "Restart the active terminal session."
      }
    ],
    "views": [
      {
        "id": "view.terminal",
        "name": "Terminal",
        "defaultContainerId": "panel"
      }
    ]
  }
}
