{
  "manifestVersion": 1,
  "id": "parallx-community.text-generator",
  "name": "Text Generator",
  "version": "0.7.0",
  "publisher": "parallx-community",
  "description": "Roleplay chat with local Ollama models — characters, lorebooks, scene memory, and a fully inspectable prompt pipeline.",
  "main": "main.js",
  "activationEvents": [
    "onStartupFinished",
    "onCommand:textGenerator.newChat",
    "onCommand:textGenerator.openHome",
    "onCommand:textGenerator.openCharacters",
    "onCommand:textGenerator.openSettings",
    "onView:textGenerator.home"
  ],
  "engines": {
    "parallx": "^0.1.0"
  },
  "contributes": {
    "commands": [
      {
        "id": "textGenerator.newChat",
        "title": "Text Generator: New Chat",
        "category": "Text Generator",
        "aiInvocable": true,
        "aiDescription": "Start a new Text Generator roleplay chat."
      },
      {
        "id": "textGenerator.openHome",
        "title": "Text Generator: Home",
        "category": "Text Generator",
        "aiInvocable": true,
        "aiDescription": "Open the Text Generator home page."
      },
      {
        "id": "textGenerator.openCharacters",
        "title": "Text Generator: Characters",
        "category": "Text Generator",
        "aiInvocable": true,
        "aiDescription": "Open the Text Generator character roster."
      },
      {
        "id": "textGenerator.openSettings",
        "title": "Text Generator: Settings",
        "category": "Text Generator",
        "aiInvocable": true,
        "aiDescription": "Open the Text Generator settings page."
      }
    ],
    "editors": [
      {
        "typeId": "text-generator-chat",
        "displayName": "Chat"
      },
      {
        "typeId": "text-generator-home",
        "displayName": "Text Generator"
      },
      {
        "typeId": "text-generator-characters",
        "displayName": "Characters"
      },
      {
        "typeId": "text-generator-settings",
        "displayName": "Settings"
      },
      {
        "typeId": "text-generator-chat-settings",
        "displayName": "Chat Settings"
      },
      {
        "typeId": "text-generator-character-editor",
        "displayName": "Character Editor"
      }
    ],
    "viewContainers": [
      {
        "id": "text-generator-container",
        "title": "Text Generator",
        "icon": "book-open",
        "location": "sidebar"
      }
    ],
    "views": [
      {
        "id": "textGenerator.home",
        "name": "Text Generator",
        "defaultContainerId": "text-generator-container"
      }
    ]
  }
}
