{
  "manifestVersion": 1,
  "id": "parallx.tool-gallery",
  "name": "Tools",
  "version": "1.0.0",
  "publisher": "parallx",
  "description": "Tool Gallery. Shows all registered tools, their status, and contribution summary.",
  "main": "./main.js",
  "engines": { "parallx": "^0.1.0" },
  "activationEvents": ["onStartupFinished"],
  "contributes": {
    "commands": [
      {
        "id": "tools.showInstalled",
        "title": "Tools: Show Installed Tools"
      }
    ],
    "viewContainers": [
      {
        "id": "tools-container",
        "title": "Tools",
        "icon": "🧩",
        "location": "sidebar"
      }
    ],
    "views": [
      {
        "id": "view.tools",
        "name": "Installed Tools",
        "defaultContainerId": "tools-container"
      }
    ]
  }
}
