{
  "manifestVersion": 1,
  "id": "parallx-community.creations-ai",
  "name": "Creations AI",
  "version": "0.7.0",
  "publisher": "parallx-community",
  "description": "Characters, roleplay and stories with the model you choose: a Character Studio with sources and a Twist, lorebooks, memory, and a fully inspectable prompt pipeline.",
  "main": "main.js",
  "activationEvents": [
    "onStartupFinished",
    "onCommand:textGenerator.newCharacter",
    "onCommand:textGenerator.newChat",
    "onCommand:textGenerator.openHome",
    "onCommand:textGenerator.openCharacters",
    "onCommand:textGenerator.openSettings",
    "onView:textGenerator.home",
    "onCommand:textGenerator.openStories",
    "onCommand:textGenerator.newStory",
    "onCommand:textGenerator.openTables",
    "onCommand:textGenerator.newTable"
  ],
  "engines": {
    "parallx": "^0.1.0"
  },
  "contributes": {
    "menus": {
      "viewContainer/title": [
        { "command": "textGenerator.newCharacter", "group": "1_new", "when": "activeViewContainer == 'text-generator-container'" },
        { "command": "textGenerator.newStory", "group": "1_new", "when": "activeViewContainer == 'text-generator-container'" },
        { "command": "textGenerator.newChat", "group": "1_new", "when": "activeViewContainer == 'text-generator-container'" },
        { "command": "textGenerator.openSettings", "group": "3_settings", "when": "activeViewContainer == 'text-generator-container'" }
      ]
    },
    "icons": [
      { "id": "px-writer", "svg": "<svg viewBox=\"0 0 24 24\" fill=\"none\" stroke=\"currentColor\" stroke-width=\"2\" stroke-linecap=\"round\" stroke-linejoin=\"round\"><rect x=\"4.5\" y=\"4\" width=\"15\" height=\"16\" rx=\"1.5\"/><path d=\"M13.6 7.5 L10.4 16.5\"/><path d=\"M12 7.5 L15.2 7.5\"/><path d=\"M8.8 16.5 L12 16.5\"/></svg>" }
    ],
    "commands": [
      {
        "id": "textGenerator.newCharacter",
        "title": "New Character",
        "category": "Creations AI",
        "aiInvocable": true,
        "aiDescription": "Open the Character Studio with an empty sheet: a character from a concept, from sources, or from sources with a Twist."
      },
      {
        "id": "textGenerator.newChat",
        "title": "New Chat",
        "category": "Creations AI",
        "aiInvocable": true,
        "aiDescription": "Start a new Creations AI roleplay chat."
      },
      {
        "id": "textGenerator.openHome",
        "title": "Home",
        "category": "Creations AI",
        "aiInvocable": true,
        "aiDescription": "Open the Creations AI home page."
      },
      {
        "id": "textGenerator.openCharacters",
        "title": "Characters",
        "category": "Creations AI",
        "aiInvocable": true,
        "aiDescription": "Open the Creations AI character roster."
      },
      {
        "id": "textGenerator.openSettings",
        "title": "Settings",
        "category": "Creations AI",
        "aiInvocable": true,
        "aiDescription": "Open the Creations AI settings page."
      },
      {
        "id": "textGenerator.openStories",
        "title": "Stories",
        "category": "Creations AI",
        "aiInvocable": true,
        "aiDescription": "Open the Story Writer: stories written in beats you steer."
      },
      {
        "id": "textGenerator.newStory",
        "title": "New Story",
        "category": "Creations AI",
        "aiInvocable": true,
        "aiDescription": "Start a new story in the Story Writer."
      },
      {
        "id": "textGenerator.openTables",
        "title": "Tables",
        "category": "Creations AI",
        "aiInvocable": true,
        "aiDescription": "Open Tables: random tables in the Perchance list grammar."
      },
      {
        "id": "textGenerator.newTable",
        "title": "New Table",
        "category": "Creations AI",
        "aiInvocable": true,
        "aiDescription": "Make a new random table."
      }
    ],
    "editors": [
      {
        "typeId": "text-generator-chat",
        "displayName": "Chat"
      },
      {
        "typeId": "text-generator-home",
        "displayName": "Creations AI"
      },
      {
        "typeId": "text-generator-characters",
        "displayName": "Characters"
      },
      {
        "typeId": "text-generator-settings",
        "displayName": "Settings"
      },
      {
        "typeId": "text-generator-chat-settings",
        "displayName": "Chat Settings"
      },
      {
        "typeId": "text-generator-character-editor",
        "displayName": "Character Studio"
      },
      {
        "typeId": "text-generator-story",
        "displayName": "Stories"
      },
      {
        "typeId": "text-generator-tables",
        "displayName": "Tables"
      }
    ],
    "viewContainers": [
      {
        "id": "text-generator-container",
        "title": "Creations AI",
        "icon": "px-writer",
        "location": "sidebar"
      }
    ],
    "views": [
      {
        "id": "textGenerator.home",
        "name": "Creations AI",
        "defaultContainerId": "text-generator-container"
      }
    ]
  }
}
