{
  "manifestVersion": 1,
  "id": "parallx-community.media-organizer",
  "name": "Atelier",
  "version": "0.13.0",
  "publisher": "parallx-community",
  "description": "Gather, organise and make: a library of photos, GIFs and videos with tags and albums, references and painting plans, and editors for photos, clips and GIFs.",
  "main": "main.js",
  "activationEvents": ["*"],
  "engines": {
    "parallx": "^0.1.0"
  },
  "contributes": {
    "icons": [
      { "id": "px-media", "svg": "<svg viewBox=\"0 0 24 24\" fill=\"none\" stroke=\"currentColor\" stroke-width=\"2\" stroke-linecap=\"round\" stroke-linejoin=\"round\"><rect x=\"4.5\" y=\"4\" width=\"15\" height=\"16\" rx=\"1.5\"/><circle cx=\"15\" cy=\"8.8\" r=\"1.6\"/><path d=\"M6.5 17 L10 12.4 L12.7 15.1 L14.8 12.8 L17.5 17\"/></svg>" }
    ],
    "commands": [
      { "id": "media-organizer.scan", "title": "Scan Directory", "category": "Atelier" },
      { "id": "media-organizer.importFiles", "title": "Import Files…", "category": "Atelier" },
      { "id": "media-organizer.cancelScan", "title": "Cancel Scan", "category": "Atelier" },
      { "id": "media-organizer.rescan", "title": "Rescan Library", "category": "Atelier" },
      { "id": "media-organizer.generateThumbnails", "title": "Generate Thumbnails", "category": "Atelier" },
      { "id": "media-organizer.cleanThumbnails", "title": "Clean Orphan Thumbnails", "category": "Atelier" },
      { "id": "media-organizer.cacheStats", "title": "Show Thumbnail Cache Stats", "category": "Atelier" },
      { "id": "media-organizer.openGrid", "title": "Open Library", "category": "Atelier" },
      { "id": "media-organizer.practiceSession", "title": "Practice Session", "category": "Atelier" },
      { "id": "media-organizer.dailyStudy", "title": "Daily Study", "category": "Atelier" },
      { "id": "media-organizer.paintingPlans", "title": "Painting Plans", "category": "Atelier" },
      { "id": "media-organizer.upscaleSetup", "title": "Set Up The Upscaler", "category": "Atelier" },
      { "id": "media-organizer.createAlbum", "title": "Create Album", "category": "Atelier" },
      { "id": "media-organizer.rebuildSearchIndex", "title": "Rebuild Search Index", "category": "Atelier" },
      { "id": "media-organizer.buildPHashes", "title": "Build Perceptual Hashes (find near-duplicates)", "category": "Atelier" },
      { "id": "media-organizer.findDuplicates", "title": "Find Duplicates", "category": "Atelier" },
      { "id": "media-organizer.saveSmartAlbum", "title": "Save Current Search as Smart Album", "category": "Atelier" },
      { "id": "media-organizer.openSmartAlbum", "title": "Open Smart Album", "category": "Atelier" },
      { "id": "media-organizer.moveToTrash", "title": "Move Selected to Trash", "category": "Atelier" },
      { "id": "media-organizer.emptyTrash", "title": "Empty Trash", "category": "Atelier" },
      { "id": "media-organizer.revealInMO", "title": "Reveal in Atelier", "category": "Atelier" },
      { "id": "media-organizer.showShortcuts", "title": "Keyboard Shortcuts", "category": "Atelier" },
      { "id": "media-organizer.recordGif", "title": "Record Screen…", "category": "Atelier" },
      { "id": "media-organizer.openClipEditor", "title": "Open Clip Editor", "category": "Atelier" },
      { "id": "media-organizer.newClipProject", "title": "New Clip Project…", "category": "Atelier" },
      { "id": "media-organizer.openClipProject", "title": "Open Clip Project…", "category": "Atelier" },
      { "id": "media-organizer.openTagReview", "title": "Open Tag Review", "category": "Atelier" },
      { "id": "media-organizer.editImage", "title": "Edit Image", "category": "Atelier" },
      { "id": "media-organizer.pasteEdit", "title": "Paste Edit Onto Selected Photos", "category": "Atelier" },
      { "id": "media-organizer.removeFromOthers", "title": "Remove Marks From Other Photos", "category": "Atelier" },
      { "id": "media-organizer.removeFromSelected", "title": "Remove Marks From Selected Photos", "category": "Atelier" }
    ],
    "viewContainers": [
      {
        "id": "media-organizer-container",
        "title": "Atelier",
        "icon": "px-media",
        "location": "sidebar"
      }
    ],
    "menus": {
      "viewContainer/title": [
        { "command": "media-organizer.rescan", "title": "Refresh", "group": "1_actions", "when": "activeViewContainer == 'media-organizer-container'" }
      ]
    },
    "views": [
      {
        "id": "mediaOrganizer.browser",
        "name": "Atelier",
        "defaultContainerId": "media-organizer-container"
      }
    ],
    "editors": [
      {
        "typeId": "media-organizer-grid",
        "displayName": "Atelier Library"
      },
      {
        "typeId": "media-organizer-clip",
        "displayName": "Clip Editor"
      },
      {
        "typeId": "media-organizer-image",
        "displayName": "Image Editor"
      }
    ],
    "configuration": [
      {
        "title": "Atelier",
        "properties": {
          "mediaOrganizer.showCardTags": {
            "type": "boolean",
            "default": true,
            "description": "Show each item's tags on the grid card next to the date. Turn off to declutter the grid; tags remain visible in the detail view and sidebar."
          },
          "mediaOrganizer.enableArtTools": {
            "type": "boolean",
            "default": false,
            "description": "Drawing and Painting Tools. Shows Daily Study, Practice Sessions and practice history in Atelier, for a workspace that holds reference photos. Off hides them; nothing is deleted."
          },
          "mediaOrganizer.practiceDailyMinutes": {
            "type": "number",
            "default": 10,
            "minimum": 1,
            "maximum": 180,
            "description": "Daily Study: minutes to draw the picture of the day."
          },
          "mediaOrganizer.practiceChime": {
            "type": "boolean",
            "default": true,
            "description": "Play a short chime when a practice picture's time is up."
          },
          "mediaOrganizer.practiceMirror": {
            "type": "boolean",
            "default": false,
            "description": "Start practice runs with the picture mirrored. Can be changed during a run."
          },
          "mediaOrganizer.practiceGreyscale": {
            "type": "boolean",
            "default": false,
            "description": "Start practice runs with the picture in greyscale. Can be changed during a run."
          },
          "mediaOrganizer.deleteMode": {
            "type": "string",
            "default": "permanent",
            "enum": ["permanent", "trash"],
            "description": "What Delete does. 'permanent' removes the items and their files at once (through Eraser when it is set up), after asking. 'trash' moves them to Trash without asking; Restore brings them back, and after 30 days they are removed the same way as a permanent delete."
          },
          "mediaOrganizer.screenRecorderTempDir": {
            "type": "string",
            "default": "",
            "description": "Folder for temporary screen recordings before they are clipped. Must be inside the open workspace. Leave empty to use .parallx/extensions/media-organizer/recordings."
          },
          "mediaOrganizer.screenRecorderAudio": {
            "type": "string",
            "default": "system",
            "enum": ["off", "system", "mic", "both"],
            "description": "Record audio into screen recordings. The sound is saved in the temp video, so MP4/WebM clip exports keep it (GIFs have no audio). 'system' captures whatever is playing on any output device (speakers, Bluetooth, USB, HDMI) via Windows loopback; 'mic' captures the default microphone; 'both' mixes the two into one track (narrate over what plays); 'off' disables audio."
          },
          "mediaOrganizer.screenRecorderCountdown": {
            "type": "string",
            "default": "0",
            "enum": ["0", "3", "5", "10"],
            "description": "Off by default: recording starts the moment you press Record. Set 3, 5 or 10 to count down inside the frame first, which gives you time to switch to the window you want to capture. Ctrl+Alt+R starts and stops a recording from any app while the frame is open; Ctrl+Alt+P pauses."
          },
          "mediaOrganizer.screenRecorderShowCursor": {
            "type": "boolean",
            "default": true,
            "description": "Include the mouse pointer in the recording. Turn off for clean product clips; the cursor path is still tracked for Smart Zoom in the clip editor."
          },
          "mediaOrganizer.screenRecorderFollowBox": {
            "type": "boolean",
            "default": false,
            "description": "Follow the box: while recording you can drag the frame around and the recording follows it, like a camera. The whole display is captured and the clip editor opens already cropped to the path you made, ready to fine-tune."
          },
          "mediaOrganizer.upscaleTileSize": {
            "type": "number",
            "default": 0,
            "description": "Tile size, in pixels, for the upscaler. 0 picks it from your GPU's memory (a 24 GB or larger card gets 1024). The tool's own automatic choice never exceeds 200 pixels, which leaves a big card mostly idle. Larger tiles are faster with identical output; if a size fails, the next smaller one is tried automatically."
          },
          "mediaOrganizer.editJpegQuality": {
            "type": "number",
            "default": 92,
            "minimum": 50,
            "maximum": 100,
            "description": "Image Editor: JPEG quality for Save As Copy, from 50 to 100. Higher keeps more detail and makes a larger file. PNG photos are saved as PNG and are not affected."
          }
        }
      }
    ]
  }
}
