{
  "manifestVersion": 1,
  "id": "parallx-community.study",
  "name": "Study",
  "version": "0.1.0",
  "publisher": "parallx-community",
  "description": "Review dense material without rereading it: multiple-choice practice, typed and essay tests graded against the text, every question anchored to its page, and only what you missed sent to Flashcards.",
  "main": "main.js",
  "activationEvents": ["onStartupFinished"],
  "engines": { "parallx": "^0.1.0" },
  "contributes": {
    "icons": [{ "id": "px-study", "svg": "<svg viewBox=\"0 0 24 24\" fill=\"none\" stroke=\"currentColor\" stroke-width=\"2\" stroke-linecap=\"round\" stroke-linejoin=\"round\"><path d=\"M4 19.5V6a2 2 0 0 1 2-2h12a2 2 0 0 1 2 2v13.5\"/><path d=\"M4 19.5A1.5 1.5 0 0 0 5.5 21H20\"/><path d=\"M9 9h6M9 13h4\"/></svg>" }],
    "commands": [
      { "id": "study.open", "title": "Open Study", "category": "Study" },
      { "id": "study.studyDocument", "title": "Study This Document…", "category": "Study" },
      { "id": "study.quizSelection", "title": "Quiz This Selection", "category": "Study" },
      { "id": "study.studyTogether", "title": "Study Materials Together…", "category": "Study" },
      { "id": "study.weakSpots", "title": "Study Weak Spots", "category": "Study" },
      { "id": "study.addMaterial", "title": "Add Material…", "category": "Study" },
      { "id": "study.importQuestions", "title": "Import Questions…", "category": "Study" },
      { "id": "study.importReport", "title": "Import Examiner's Report…", "category": "Study" }
    ],
    "viewContainers": [{ "id": "study-container", "title": "Study", "icon": "px-study", "location": "sidebar" }],
    "views": [{ "id": "study.materials", "name": "Materials", "defaultContainerId": "study-container" }],
    "editors": [{ "typeId": "study", "displayName": "Study" }],
    "menus": {
      "editor/title": [{ "command": "study.studyDocument", "when": "activeEditor == 'parallx.editor.pdf'" }],
      "viewContainer/title": [
        { "command": "study.addMaterial", "title": "Add Material…", "group": "1_actions", "when": "activeViewContainer == 'study-container'" },
        { "command": "study.importQuestions", "title": "Import Questions…", "group": "1_actions", "when": "activeViewContainer == 'study-container'" },
        { "command": "study.importReport", "title": "Import Examiner's Report…", "group": "1_actions", "when": "activeViewContainer == 'study-container'" }
      ]
    },
    "configuration": [{ "title": "Study", "properties": {
      "study.sessionSize":        { "type": "number",  "default": 20, "description": "Questions per session. Refresh draws the next set from the same scope." },
      "study.choices":            { "type": "number",  "default": 4,  "description": "Options per multiple-choice question: 4 or 5." },
      "study.questionsPerConcept":{ "type": "number",  "default": 2,  "description": "How many questions of each format a concept needs before generation considers it covered." },
      "study.answerFormat":       { "type": "string",  "default": "mixed", "description": "Default answer format for a new session: choose, type, or mixed. Mixed starts on choices and moves a concept to typing once it has been answered right." },
      "study.syllabus":           { "type": "string",  "default": "", "editPresentation": "multilineText", "rows": 8, "description": "What your exam expects: paste the syllabus or learning objectives. Concepts and questions are aimed at it. Empty: questions follow the material alone." },
      "study.aiModel":            { "type": "string",  "default": "", "description": "Model id used to write and grade questions. Leave empty to use the chat's active model." },
      "study.generationContext":  { "type": "number",  "default": 0,  "description": "Context window (tokens) for generation and grading. 0 = auto: sized per run from the scope's length and the model's limit. A fixed value caps VRAM on a smaller machine." },
      "study.aiThinking":         { "type": "boolean", "default": true, "description": "Let reasoning models think before writing or grading. Better questions and fairer grading, at the cost of slower runs. Turn it off only on a machine where generation is too slow." },
      "study.checkAnchor":        { "type": "boolean", "default": true, "description": "Drop a question whose quote is not on its page." },
      "study.checkSupport":       { "type": "boolean", "default": true, "description": "Drop a question whose quote, read with its page, does not settle its answer." },
      "study.checkDistractors":   { "type": "boolean", "default": true, "description": "Drop a multiple-choice question when any wrong option could be defended as correct." },
      "study.checkNumeric":       { "type": "boolean", "default": true, "description": "Keep a numeric question only when its solution, run in Python, agrees with the stated answer. Needs the workspace Python environment." },
      "study.numericTolerance":   { "type": "number",  "default": 0.005, "description": "Relative tolerance for a numeric answer to count as right (0.005 = half a percent)." },
      "study.staleDays":          { "type": "number",  "default": 14, "description": "Days without an answer before a clean concept counts as stale." }
    }}]
  }
}
