{
  "manifestVersion": 1,
  "id": "parallx.output",
  "name": "Output",
  "version": "1.0.0",
  "publisher": "parallx",
  "description": "Output panel. Shows log messages from tools and the shell.",
  "main": "./main.js",
  "engines": { "parallx": "^0.1.0" },
  "activationEvents": ["onStartupFinished"],
  "contributes": {
    "commands": [
      {
        "id": "output.clear",
        "title": "Output: Clear Log"
      },
      {
        "id": "output.toggleTimestamps",
        "title": "Output: Toggle Timestamps"
      }
    ],
    "views": [
      {
        "id": "view.output",
        "name": "Output",
        "defaultContainerId": "panel"
      }
    ]
  }
}
